comentario,comunidade_link,comunidade_texto,data_comentario,link_topico,nome_comentador,nome_topico,num_comentario
"Então: As armas de guerra do crime - e as drogas - passam pelas fronteiras abertas do país tropical. As mortes violentas de brasileiros comuns, há muito tempo superam as estatísticas de mortes das guerras no Oriente Médio. Agora, são as mortes de agentes de Estado que superam as guerras. Os brasileiros há muito estão escondidos atrás das grades de suas casas. Agora, são as autoridades que são acuadas. Há muito, o crime vem sendo comandado por celulares, dos presídios. Todos nós sabemos. Há muito, ônibus são incendiados pelo crime em Vitória e no Rio de Janeiro. Não é a primeira vez que o crime ataca a polícia - já atacou quartéis das Forças Armadas. A rebelião mostra poder de ser nacional e, com arrogância. Não foi por falta de aviso. Foi por falta de competência e de vergonha. Porque se falta dinheiro para a segurança ou para a educação, não tem faltado para sanguessugas e mensaleiros, maus exemplos de imunidade dos que fazem as leis da impunidade!!! Esta mensagem foi enviada por Labestia Jr. o criminoso da ordem político nacional (reeleição) e internacional (Colômbia, Venezuela e Cuba) ""fornecedores"" de cocaína e da política na América Latina para a implantação da URSAL - União das Repúblicas Socialistas da América Latina. Neste último fim de semana assistimos, estarrecidos, os acontecimentos violentos contra o Sistema de Segurança do Estado de São Paulo. Os meios de comunicação e o próprio governo nos informam que, a principal razão para os atos de ""barbárie"", seria a transferência de presos para um determinado presídio. Será? Todos nós brasileiros aprendemos, depois de tantos anos de violência e corrupção, que bandido, bandido mesmo, seja ele traficante, ladrão de banco, corrupto e, até mesmo os ladrões-de-galinhas, não agiriam contra seus próprios ""empreendimentos"" (se é que vocês me entendem). Bandido que é bandido, faz de tudo para manter seus ""pontos"", suas ""bocas de fumo"", suas ""fontes de renda"", bandido que é bandido, não age politicamente, não entra em confronto, assim, ""de graça"" com a polícia.",http://orkut.google.com/c316707.html,Geraldo Alckmin,10 de outubro de 2006,http://orkut.google.com/c316707-tb3de3e255e47a467.html,Edna maria - ,PT e PCC - OAB/PB denuncia,28
"Por isso os dirigentes do PCC estão entre a cruz e a caldeirinha: Ou, enfrentam todo o Sistema de Segurança do Estado mais poderoso de nosso país, ou correm o risco de ficar sem o ""GÁS-COCA"" que alimenta o mercado das drogas. É hora de pensarmos seriamente sobre os riscos que Hugo Chávez e vários outros dirigentes de países e partidos que se dizem ""esquerdistas"", inclusive em nosso país, estão criando para a democracia de nosso tão amado Brasil. Afinal, é bem mais fácil negociar com o partido brasileiro, onde o atual presidente(PT)- liberou uma TV só para Hugo Chávez, a Tele Sur, pelo fato do partido ter aceitado dinheiro das FARC e de Cuba e que tinha, como projeto de uma de suas facções a previsão de arrecadar US$ 1.000.000.000,00 (Um bilhão de dólares) para transformar a América Latina num território ""esquerdista"" (URSAL) e plantador de coca. (Estão aí a morte de Celso Daniel, o Escândalo do Mensalão, as falcatruas publicitárias, e tantas coisas mais). Se o Governo de São Paulo quer realmente desvendar essa farsa, basta investigar mais seriamente os criminosos, que estão se passando por advogados dos comandantes do PCC. Comecem a investigar as ""viagens"" e de onde está vindo o dinheiro desses ""ditos advogados"" que, em verdade, são bandidos que possuem as carteirinhas da OAB e estão repassando as ordens vindas da Colômbia, Venezuela, Bolívia e Cuba. São eles que estão trazendo as ordens dos ""fornecedores"" para serem repassadas ao comando do PCC, pois eles são patrocinados pelos chefões que financiam o tráfico e a política na América Latina. Todos sabemos, é do conhecimento geral - Bandido não rasga dinheiro à toa e não age politicamente sem que um comando maior esteja por trás. Esses atos de barbárie são, com certeza, políticos mas, se Deus quiser, assim como o mensalão e tantas outras falcatruas, irão ser passados à limpo.",http://orkut.google.com/c316707.html,Geraldo Alckmin,10 de outubro de 2006,http://orkut.google.com/c316707-tb3de3e255e47a467.html,Edna maria - ,PT e PCC - OAB/PB denuncia,30
"A rebelião mostra poder de ser nacional e, com arrogância. Não foi por falta de aviso. Foi por falta de competência e de vergonha. Porque se falta dinheiro para a segurança ou para a educação, não tem faltado para sanguessugas e mensaleiros, maus exemplos de imunidade dos que fazem as leis da impunidade!!! O criminoso da ordem político nacional (reeleição) e internacional (Colômbia, Venezuela e Cuba) ""fornecedores"" de cocaína e da política na América Latina para a implantação da URSAL - União das Repúblicas Socialistas da América Latina . Neste último fim de semana assistimos, estarrecidos, os acontecimentos violentos contra o Sistema de Segurança do Estado de São Paulo. Os meios de comunicação e o próprio governo nos informam que, a principal razão para os atos de ""barbárie"", seria a transferência de presos para um determinado presídio. Será? Todos nós brasileiros aprendemos, depois de tantos anos de violência e corrupção, que bandido, bandido mesmo, seja ele traficante, ladrão de banco, corrupto e, até mesmo os ladrões-de-galinhas, não agiriam contra seus próprios ""empreendimentos"" (se é que vocês me entendem). Bandido que é bandido, faz de tudo para manter seus ""pontos"", suas ""bocas de fumo"", suas ""fontes de renda"", bandido que é bandido, não age politicamente, não entra em confronto, assim, ""de graça"" com a polícia. Isso representa prejuízo muito grande para seus negócios. Rebeliões em presídios sempre aconteceram, por conta de super-lotação, melhores condições para os presos, etc. Mas, esta rebelião contra o Sistema de Segurança do Estado de São Paulo possui, claramente, um objetivo político. Os chefões do PCC não arriscariam o lucro com o comércio de drogas em São Paulo e não colocariam todo o sistema de segurança em alerta, contra suas ""fontes de renda"", pelo simples fato de terem sido transferidos para um determinado presídio.  Então, nos perguntamos:- Por que esta rebelião acontece agora, justamente no Estado de São Paulo?",http://orkut.google.com/c316707.html,Geraldo Alckmin,14 de outubro de 2006,http://orkut.google.com/c316707-t37d958e0eb9d7058.html,Luana Ramos Oliveira - ,"Recebi notícia de um novo ESCÂNDALO, é verdade?",2
"Pelo fim do autoritarismo,se vc nao quer viver em estado de pseudo-ditadura,que como a besta preve e se geraldo alckmin nao ganhar,tente pelo menos convencer a quem vota nula a votar no Alckmin.Eles sao o povo do mal!Eles querem que vc faça parte da URSAL,Uniao das Republicas Socialistas da America Latina,eles vao te controlar,ja tentaram 2 vezes censurar a imprensa numa especie de AI-5 lighte pod ter certeza que vao fazer,por Deus,por tudo que eh mais sagrado,essa gente pode por a perder o que foi conseguido em anos de esforço pra no livrar das mazelas da ditadura.E nao venham falar q isso eh exagero,qualque um sabe que as tendencias que norteam o PT sao autoritaristas,nao permitam que surjam novos Stalins,que ao invez de te matar na siberia,te mata de outra forma pouco a pouco,te tira a esperança e faz com que vc viva num estado vegetativo soh assistindo e por final contribuindo para a derrocada da mais solida dmocracia da america latina.tentem mudar os votos de quem anulou,ou diz que vai anular,e se for pHd em psiquiatria tentem mudar o dos petistas tambem.Ronald Reagan",http://orkut.google.com/c316707.html,Geraldo Alckmin,15 de outubro de 2006,http://orkut.google.com/c316707-tf4f1c6bbc7e4ddc5.html,Ronald Reagan © - ,Pelo fim do autoritarismo,1
"O PSDB deveria ter expulsado,ou deverá expulsar o Lucio Alcantara.Pois fazer o q ele fez,não se faz.Assim como Eduardo Paes,no rio de janeiro,Lucio alcantara,pensou mais em si e nos seus projetos de poder do q no Brasil.Não pensou q se a quadrilha continuar no poder,pode ser q daqui a 4 anos,não exista mais o Brasil e sim a Ursal.Simplesmente quer fazer média com aquele bando de ignorantes q estão se vendendo por um bolsa esmola.Deveriam tentar localizar as pessoas,ao invés de se aproveitarem da ignorancia delas em proveito proprio.",http://orkut.google.com/c316707.html,Geraldo Alckmin,1 de setembro de 2006,http://orkut.google.com/c316707-t177f8c1b2f68fbe7.html,Patrick Santos - ,Comando do PSDB desiste de Alckmin no Nordeste!!!,8
"Não foi por falta de aviso. Foi por falta de competência e de vergonha. Porque se falta dinheiro para a segurança ou para a educação, não tem faltado para sanguessugas e mensaleiros, maus exemplos de imunidade dos que fazem as leis da impunidade!!!Esta mensagem foi enviada por Labestia Jr. o criminoso da ordem político nacional (reeleição) e internacional (Colômbia, Venezuela e Cuba) ""fornecedores"" de cocaína e da política na América Latina para a implantação da URSAL União das Repúblicas Socialistas da América Latina.Neste último fim de semana assistimos, estarrecidos, os acontecimentos violentos contra o Sistema de Segurança do Estado de São Paulo. Os meios de comunicação e o próprio governo nos informam que a principal razão para os atos de ""barbárie"" seria a transferência de presos para um determinado presídio. Será?Todos nós brasileiros aprendemos, depois de tantos anos de violência e corrupção, que bandido, bandido mesmo, seja ele traficante, ladrão de banco, corrupto e, até mesmo os ladrões-de-galinhas, não agiriam contra seus próprios ""empreendimentos"" (se é que vocês me entendem).Bandido que é bandido faz de tudo para manter seus ""pontos"", suas ""bocas de fumo"", suas ""fontes de renda"", bandido que é bandido, não age politicamente, não entra em confronto, assim, ""de graça"" com a polícia. Isso representa prejuízo muito grande para seus negócios.Rebeliões em presídios sempre aconteceram, por conta de super-lotação, melhores condições para os presos, etc.Mas, esta rebelião contra o Sistema de Segurança do Estado de São Paulo possui, claramente, um objetivo político.Os chefões do PCC não arriscariam o lucro com o comércio de drogas em São Paulo e não colocariam todo o sistema de segurança em alerta, contra suas ""fontes de renda"", pelo simples fato de terem sido transferidos para um determinado presídio.Então, nos perguntamos:Por que esta rebelião acontece agora, justamente no Estado de São Paulo?",http://orkut.google.com/c316707.html,Geraldo Alckmin,20 de julho de 2006,http://orkut.google.com/c316707-t41dd0b713109f0cd.html,Newton J. Santos - ,Rebelião em São Paulo financiada pelo PT !!!,2
"US$ 1.000.000.000,00 (Um bilhão de dólares) para transformar a América Latina num território ""esquerdista"" (URSAL) e plantador de coca. (Estão aí a morte de Celso Daniel, o Escândalo do Mensalão, as falcatruas publicitárias, e tantas coisas a mais).Se o Governo de São Paulo quer realmente desvendar essa farsa, basta investigar mais seriamente os criminosos, que estão se passando por advogados dos comandantes do PCCs. Comecem a investigar as ""viagens"" e de onde está vindo o dinheiro desses ""ditos advogados"" que, em verdade são bandidos que possuem as carteirinhas da OAB e estão repassando as ordens vindas da Colômbia, Venezuela e Cuba.São eles que estão trazendo as ordens dos ""fornecedores"" para serem repassadas ao comando do PCC, pois eles são patrocinados pelos chefões que financiam o tráfico e a política na América Latina.Todos sabemos, é do conhecimento geral:Bandido não rasga dinheiro à toa e não age politicamente sem que um comando maior esteja por trás. Esses atos de barbárie são, com certeza, políticos mas, se Deus quiser, assim como o mensalão e tantos outras falcatruas, irão ser passados à limpo.Tudo o que está acontecendo em São Paulo foi arquitetado pelo Palácio do Planalto para ""mudar o foco"" das denúncias da revista Veja sobre as contas em paraísos fiscais que seriam do presidente Lula e do resto do PT e para acabar com a credibilidade do candidato do PSDB Geraldo Alckmin, cuja base eleitoral é São Paulo. Mais detalhes veja abaixo.E HÁ CEGOS QUE NÃO QUEREM VER !!!!Já tenho mencionado isso a mais de um mês, mas vou repetir e podem mandar para quem quiserem o que aqui abaixo vou escrever. Estava mais que na cara que este partido de comunistas iria fazer algo para acabar com a credibilidade do único candidato que poderia interferir na sua sede inescrupulosa pelo poder, que eles detém a fim de perpetuar no comando da nação o imbecílico Dom Luiz Ignácio Corleone.",http://orkut.google.com/c316707.html,Geraldo Alckmin,20 de julho de 2006,http://orkut.google.com/c316707-t41dd0b713109f0cd.html,Newton J. Santos - ,Rebelião em São Paulo financiada pelo PT !!!,4
"Não foi por falta de aviso. Foi por falta de competência e de vergonha. Porque se falta dinheiro para a segurança ou para a educação, não tem faltado para sanguessugas e mensaleiros, maus exemplos de imunidade dos que fazem as leis da impunidade!!!Esta mensagem foi enviada por Labestia Jr. o criminoso da ordem político nacional (reeleição) e internacional (Colômbia, Venezuela e Cuba) ""fornecedores"" de cocaína e da política na América Latina para a implantação da URSAL União das Repúblicas Socialistas da América Latina.Neste último fim de semana assistimos, estarrecidos, os acontecimentos violentos contra o Sistema de Segurança do Estado de São Paulo. Os meios de comunicação e o próprio governo nos informam que a principal razão para os atos de ""barbárie"" seria a transferência de presos para um determinado presídio. Será?Todos nós brasileiros aprendemos, depois de tantos anos de violência e corrupção, que bandido, bandido mesmo, seja ele traficante, ladrão de banco, corrupto e, até mesmo os ladrões-de-galinhas, não agiriam contra seus próprios ""empreendimentos"" (se é que vocês me entendem).Bandido que é bandido faz de tudo para manter seus ""pontos"", suas ""bocas de fumo"", suas ""fontes de renda"", bandido que é bandido, não age politicamente, não entra em confronto, assim, ""de graça"" com a polícia. Isso representa prejuízo muito grande para seus negócios.Rebeliões em presídios sempre aconteceram, por conta de super-lotação, melhores condições para os presos, etc.Mas, esta rebelião contra o Sistema de Segurança do Estado de São Paulo possui, claramente, um objetivo político.Os chefões do PCC não arriscariam o lucro com o comércio de drogas em São Paulo e não colocariam todo o sistema de segurança em alerta, contra suas ""fontes de renda"", pelo simples fato de terem sido transferidos para um determinado presídio.Então, nos perguntamos:Por que esta rebelião acontece agora, justamente no Estado de São Paulo?",http://orkut.google.com/c316707.html,Geraldo Alckmin,20 de julho de 2006,http://orkut.google.com/c316707-t41dd0b713109f0cd.html,Newton J. Santos - ,Rebelião em São Paulo financiada pelo PT !!!,2
"ESTÃO QUERENDO COLOCAR O POVO DE SP SOB O JUGO DO MEDO.ESTÃO QUERENDO TRANSFORMAR O BRASIL NUMA NOVA CUBA,MUITO MAIS PERIGOSA.MAS ESSE MOLUSCO FILHO DA PUTA PARA CONSEGUIR SE MANTER NO PODER E POR MEIA DUZIA DE MILHÕES DE DOLARES ESTÁ FAZENDO ACORDO COM O COISA RUIM.DEPOIS Q O COISA RUIM VIER COBRAR A ALMA DELE,ELE NÃO PODE RECLAMAR.SE AS COISAS CONTINUAREM COMO ESTÃO E OLHE Q TO FALANDO SERIO,MUITO SÉRIO,DAQUI A ALGUNS ANOS(NÃO DEMORA MUITO),UM GENERAL MUITO PROXIMO DE NÓS ESTARA DESEMBARCANDO NO BRASIL,FALANDO CASTELHANO,E SIMPLESMENTE SE AUTO INTITULANDO COMO O NOVO PRESIDENTE DA URSAL.ESPEREM PRA VER.EU CONCLAMO A TODOS OS BOINAS PRETAS,BOINAS AZUIS,E TODOS Q SE LEMBRAM DESSA FRASE:""OS BOINAS PRETAS NÃO MORREM,APOS A MORTE VÃO PRO INFERNO ATORMENTAR O CAPETA""POIS BEM,CONCLAMO A TODOS Q FIQUEM DE PRONTIDÃO,PQ O BICHO VAI PEGAR.",http://orkut.google.com/c316707.html,Geraldo Alckmin,13 de julho de 2006,http://orkut.google.com/c316707-t52177d7956c50416.html,Patrick Santos - ,RESISTENCIA JÁ..DESPERTA BRASIL,1
"Delenda Carthago (Cartago deve ser destruída). Catão dizia sempre isso, no fim de todos os seus discursos.Depois da queda do Muro de Berlim em 1989, Fidel Castro convocou em 1990, junto com Luis Inácio “Lula” da Silva e o PT, partidos estrangeiros, grupos guerrilheiros, organizações criminosas, ... da América Latina, a uma reunião na cidade de São Paulo onde se associaram numa organização denominada Foro de São Paulo.O objetivo do Foro de São Paulo é o de apoiar política e financeiramente a implantação do comunismo na América Latina. Atualmente, é implantado por diversos modos, através de meios gramscistas, via partidos de esquerda, “Círculos Bolivarianos”, para a concretização da URSAL (União das Repúblicas Socialistas da América Latina).Este espaço é para a formulação de idéias que levem à neutralização do totalitário FORO DE SÃO PAULO!Delenda Chaves, Fidel, Evo, Lula, FARC, MST, Comunistas, Esquerdopatas,...Delenda URSAL (atualmente batizada de UNASUL)!Convido p/ a Comu DELENDA FORO DE SÃO PAULO:http://www.orkut.com.br/Main#Community.aspx?cmm=42203706Esta Comu combate o comunismo bolivariano. Junte-se a nós.",http://orkut.google.com/c7366019.html,Grupo Guararapes - Apoio,30 de novembro de 2008,http://orkut.google.com/c7366019-t2edff7ee38ce3fb.html,Adonai Camargo - ,DELENDA FORO DE SÃO PAULO,1
""" URSAL ""UNIÃO REPUBLICAS SOCIALISTAS AMERICA LATINA .SOU PLENAMENTE FAVORAVEL A UM GOLPE DE ESTADO , O QUE NÃO SIGINIFICA QUE VENHAMOS A TER UM PRESIDENTE MILITAR . ESTA NAÇÃO AINDA TEM MUITOS BRASILEIROS COMPETENTES E HONESTOS O SUFICIENTE PARA GOVERNAR O PAIS .PREFIRO O RISCO DE "" UMA GUERRA CIVIL"" DO QUE VER O BRASIL SE TRANSFORMAR EM UMA  "" REPUBLICA COMUNISTA ""GLOUZADABRASIL ACIMA DE TUDO",http://orkut.google.com/c7366019.html,Grupo Guararapes - Apoio,11 de maio de 2008,http://orkut.google.com/c7366019-t718a20c223cd10f8.html,GE LOUZADA - ,O PIOR CEGO É AQUELE QUE SE RECUSA A ENCHERGAR .,6
leio seguidamente os tópicos desta comuna e confesso que aprendi muito com vários particpantes que demonstraram ser realmente amantes da história e da estratégia miliatar.mas fiquei preucupado com este tópico pois ninguém abordou um assunto antes oculto ao grande público e sem a devida importância a mídia até o momento. me refiro ao foro de são paulo e ao seu projeto- ursal ( união das repúblicas socialistas da américa latina).,http://orkut.google.com/c210762.html,História Militar e Estratégia,5 de março de 2007,http://orkut.google.com/c210762-tca3f2adde0ae7045.html,MARCELO mendes - ,Política Externa do Brasil e América do Sul,13
"Ajude Olavo de Carvalho contra a dominação e a ditadura fascisto-comunista na América LatinaAno de 2014, Dilma vence as eleições presidenciais no Brasil. A vigésima cúpula do Foro de São Paulo em Cochabamba na Bolívia decide que esse é o momento ideal para dar início ao golpe comunista na América Latina.Brasil, Cuba, Venezuela, Bolívia e Nicarágua juntam-se em uma Confederação nomeada de União das Repúblicas Socialistas da América Latina (URSAL). O povo no Brasil é contra, mas o PT tem o controle das ruas graças a uma aliança com o PCC. O partido controla as urnas eletrônicas e dessa maneira consegue aprovar a união via referendo. Tem início uma política de confisco dos meios de produção. O governo em Brasília controla toda produção industrial, assim como a produção e a venda de drogas.Os líderes do governo se escondem dentro de um bunker em um local não identificado em Brasília. Eles estão munidos de muitas armas e drogas e de lá enviam suas ordens para todo o país. Fazem a segurança do bunker gangsters do PCC, militantes feminazis, black blocs e soldados russos especialmente enviados para proteger o governo latino-americano.Entretanto, só um homem é capaz de acabar com essa união criminosa: Olavo de Carvalho. O professor vai se infiltrar no bunker e terá como missão matar os líderes do governo para trazer de volta a paz na América Latina.https://www.youtube.com/watch?v=FXxsLnUg9DILinks para download:Mega: https://mega.co.nz/#!B9AU3IBK!T9_5RWY...Anonfiles: https://anonfiles.com/file/30eb369872...Não precisa instalar nada. É só extrair a pasta e executar o jogo.Obrigado a todos que colaboraram com ideias. E obrigado, principalmente, ao professor Olavo de Carvalho por sua existência e pela sua coragem na luta contra o comunismo no Brasil.",http://orkut.google.com/c795788.html,HISTÓRIA,1 de maio de 2014,http://orkut.google.com/c795788-t7ad5bad35261511.html,Gregory Vieira Souto - ,Guie o professor Olavo contra o golpe comunista,1
tao se organizando para criar ursal e exercito conjunto para atacar eua.==vai ser interessante traidor obama ter que enfrentar o eixo do mal.,http://orkut.google.com/c795788.html,HISTÓRIA,28 de junho de 2008,http://orkut.google.com/c795788-t3c7a588aeca51c8c.html,Massa Sofrida e Preparada - ,Possível guerra em 2010?,13
"kya asli naam? frnds call me paddy, family members call padu, nana nani given name is parimal, dada - dadi given name is madhusudan, some frnds call me maddy ( heros name of RHTDM movie ) official name is padmanabh ursal or P. P. Ursal.bass filhaal itne hi hai ....",http://orkut.google.com/c57285458.html,Indian Warriors [IW]™©,4 de junho de 2010,http://orkut.google.com/c57285458-t9b408a95971567db.html,Padmanabh Ursal - ,╘ ♥CHAT THREAD♥ ╛,52
"Hi,Attention :- BE, MCA,MCM freshers looking for a job.Chance to get a 16000 INR / Month job in Pune (as a developer) in good IT company.Incase interested please email me on santtosh.g.ursal@gmail.comIts neither a fake nor trying market some company but just trying to help people who are looking for job.As we all know economy is going worse day by day so this can be a good choice to go on.",http://orkut.google.com/c24625990.html,IT jobs in PUNE,26 de novembro de 2008,http://orkut.google.com/c24625990-t399b7d875de620a2.html,Santtosh G Ursal - ,Fresher job in Pune,1
"Hi,Attention :- BE, MCA,MCM freshers looking for a job.Chance to get a 16000 INR / Month job in Pune (as a developer) in good IT company.Incase interested please email me on santtosh.g.ursal@gmail.comIts neither a fake nor trying market some company but just trying to help people who are looking for job.As we all know economy is going worse day by day so this can be a good choice to go on.",http://orkut.google.com/c24625990.html,IT jobs in PUNE,26 de novembro de 2008,http://orkut.google.com/c24625990-t4bcf9afcb7731305.html,Santtosh G Ursal - ,Hi,1
"é filhote sim, na verdade é a URSAL só que com outro nome",http://orkut.google.com/c8585489.html,Juventude de Extrema Direita,30 de setembro de 2009,http://orkut.google.com/c8585489-te3a851e89c6ae671.html,Moises Amon Thompson - ,Unasul,2
"Camaradas... A greve é nosso direito institucional de concientização popular democratica, e de maneira alguma pode ser ultrajada sobre maneira, seguindo dessa forma ideiais neoliberais.Todo ser desprezivel (lê-se, neoliberal) que condenar a greve deve ser imediatamente condecorado com ""el paredon"".Pois nesta sociedade burguesa e capitalista ao qual estamos subservientes, a greve, tende ser utilizada como o ""grito"" das massas com relação ao capital explorador.Se necessário for, entregaremos ao nosso Deus ""Marx"", um bilhão de vidas de criancinhas para atender as necessidades da revolução.Portanto todo camarada, jamais poderá ser contra qualquer tipo de greve, enquanto vivermos nesta podre sociedade burguesa e neoliberal.Claro... após instalarmos a revolução, e nosso ""el presidente"" da URSAL, excelêntissimo senhor Hugo  ""Chapolin de Miraflores"" Chaves, ascender como nosso Supremo comandante em chefe, logicamente as greves serão existintas pois não mais haverá motivos, sendo qualquer atitude contrária, considerada ""atentado terrorista"" contra ""la revolucion"" condenando o ""desinformado"" ao ""paredoón""...Viva la revolucionViva TcheViva FidelViva Chaves",http://orkut.google.com/c23318941.html,Jornal Opinião Popular,3 de março de 2007,http://orkut.google.com/c23318941-t28acb4cc59a1a2f7.html,Julio Cazaroto - ,Excelente exemplo do camarada Paulo Bernardo.,2
