comentario,comunidade_link,comunidade_texto,data_comentario,link_topico,nome_comentador,nome_topico,num_comentario
"AvançosEm nome da delagação estrangeira que participou do seminário sobre os desafios da esquerda na América Latina e Caribenha, falou o cubano Jorge Ferreira, integrante da Comisssão de Relações Internacionais do Partido Comunista de Cuba. Ferreira destacou a ""extraordinária e rotunda vitória de lula com apoio do povo brasileiro"", nas eleições do ano passado e disse que tinha granade honra de participar do aniversário do PT, bem como de representar seus companheiros do seminário. Segundo ele, a partir do triunfo do PT no Brasil, criaram-se as condições para o avanço da esquerda na América Latina.É A URSAL SE FORMANDO!!!!!",http://orkut.google.com/c69619.html,Teoria da Conspiração,10 de fevereiro de 2007,http://orkut.google.com/c69619-t79c4dfd7320973e1.html,MARCELO mendes - ,URSAL A VERDADEIRA CONSPIRAÇÃO,23
"São tantos indiciamentos, tantas aberturas de processo, tantas CPIs... Quando é, afinal, que se chegará ao cerne da questão?O presidente Lula tem sido apontado na mídia, quase que unanimemente, como irresponsável e como incompetente, pela forma como vem tratando a crise no setor aéreo brasileiro. O problema, na verdade, é que aqueles que criticam o presidente, ou por falta de visão ou de informação (ou por outra coisa que eu me recuso a acreditar), não conseguiram, ainda, identificar o que são, para Lula, na realidade, suas reais e mais importantes competências e responsabilidades.É a mesma confusão que existe quando se fala em democracia. O termo, acreditem, pode ter significados até mesmo antagônicos, dependendo de quem o esteja proferindo. Lula governa um Brasil ideológico, que está além das fronteiras geográficas – um Brasil inserido numa grande pátria socialista. Quando se passa a olhar o Brasil a partir de sua inserção na União das Repúblicas Socialistas da América Latina ( URSAL), tudo muda de figura, até mesmo, e como não poderia deixar de ser, o julgamento a respeito das qualidades e do modo de atuação de Lula em relação ao governo do Brasil. As concessões feitas ao boliviano Evo Morales, em detrimento da Petrobrás e do Brasil (aquele que muita gente pensa que é o mesmo de Lula) e as liberdades tomadas por Hugo Chávez, presidente eterno da Venezuela, em território brasileiro seriam apenas dois dos exemplos disso.",http://orkut.google.com/c69619.html,Teoria da Conspiração,7 de abril de 2007,http://orkut.google.com/c69619-t79c4dfd7320973e1.html,MARCELO mendes - ,URSAL A VERDADEIRA CONSPIRAÇÃO,64
"Aliás, teríamos tantos como esses dois, que fica impossível acreditar que nossos homens de mídia ainda continuem a mostrar as diversas ""crises"" que perpassam o governo Lula, a partir de considerações eminentemente nacionais ou ainda reduzindo-as a fruto de cobiças financeiras individuais ou de grupos específicos. Cada vez que se ressalta o enriquecimento ilícito (e aqui estão incluídas as distribuições de cargos e privilégios) como agente causador principal deste ou daquele procedimento criminoso, que acabou se transformando em mais um dos grandes escândalos nacionais, desvia-se do ponto central da questão: a caminhada do país em direção a um socialismo, aos moldes do que já está em pleno funcionamento na Bolívia e na Venezuela. Hugo Chavez já não faz a menor questão de se disfarçar de democrata. Evo Morales também não, e pretende ficar na ""presidência"" da Bolívia até 2018.Na verdade, Lula e o PT (e isso não começou com eles) estariam agindo dentro da maior competência quando se trata de dissimular seu comprometimento com a URSAL, contando, é claro, com uma incrível cegueira da intelectualidade e da mídia nacionais, e, dentro da maior coerência, ao permitir com que, aos poucos, todos os nossos alicerces democráticos venham a ser destruídos, com que todas as nossas instituições acabem por ser desmoralizadas e enfraquecidas, ao mesmo tempo em que promovem a divisão dos brasileiros (pobres contra ricos, brancos contra negros, nordestinos contra sulistas) e falham, digamos assim, na contenção das ações, e, depois, na punição, dos envolvidos em invasões de terra e de propriedades, dos envolvidos em escândalos de crime e de corrupção e, por que não dizer, no combate à criminalidade e ao terrorismo. Os jornais estão cheios de exemplos.",http://orkut.google.com/c69619.html,Teoria da Conspiração,7 de abril de 2007,http://orkut.google.com/c69619-t79c4dfd7320973e1.html,MARCELO mendes - ,URSAL A VERDADEIRA CONSPIRAÇÃO,65
ALCA(3) - URSAL(2),http://orkut.google.com/c69619.html,Teoria da Conspiração,25 de maio de 2008,http://orkut.google.com/c69619-tc5d52f8b0a0e61ff.html,MARCELO mendes - ,IIRSA,7
"Essa ursal ainda é só um documento de intenções.. ainda falta muito ou melhor, quase tudo pro projeto se consolidar e avançar. O mercosul continua. Ele tá anos a frente em termos de derrubada de barreiras e tal.. Já é uma uniao aduaneia caminhando pra união economica. Essa ursal talvez nem ande como vários outros blocos economicos que existem por ai só na teoria.E essa uniao norte americana pior ainda..Se for , num vai passar de uma relação bilateral entre USA e Canada.",http://orkut.google.com/c69619.html,Teoria da Conspiração,21 de maio de 2008,http://orkut.google.com/c69619-t7b2c1a5395f5736e.html,Tiago Costa - ,NASCE A URSAL,9
KKKKKKKKK!!! DEPOIS DE 17 ANOS DA DENÚNCIA SIM!!! SÓ DEPOIS DO VÍDEO TER VASADO.AQUI TEM ALGUMA COISA QUE RETIREI DO SITE DO PT NA ÉPOCA - http://www.orkut.com/CommMsgs.aspx?cmm=69619&tid=2510344842648937606&kw=URSAL&na=3&nst=61&nid=69619-2510344842648937606-2510455472431388995,http://orkut.google.com/c69619.html,Teoria da Conspiração,13 de maio de 2008,http://orkut.google.com/c69619-t7dbc06b1376f88d.html,MARCELO mendes - ,COMANDO SUL BOLIVARIANO EM SÃO PAULO,17
ESTA TUDO CORRENDO CONFORME OS PLANOS.FORO DE SÃO PAULO DOMINA QUASE TODA A. DO SUL CONSEQUENTEMENTE DOMINAM A O.E.Ahttp://bp0.blogger.com/_HY_TtmInUpk/R-jqhURBtsI/AAAAAAAAAF0/4yvqCcDV2ow/s1600/Foro%2Bde%2BS%C3%A3o%2BPaulo.jpgJÁ VAI NASCER A UNASUR (QUE CHAMEI DE URSAL).... O EMPENHO PARA TIRAR O RÓTULO DAS FARC DE TERRORISTAS ESTA EM ANDAMENTO. NA SEMANA PASSADA O P. EUROPEU RETIROU O GRUPO GUERRILHEIRO TUPAC AMARO DA LISTA DE TERRORISTAS.A FRENTE FRANCISCO DE MIRANDA JÁ ESTA ATIVA DESDE 2003. OS ETARRAS ESTÃO NA ARGENTINA (CURSANDO FACULDADE DAS MÃES DA PRAÇA DE MAIO) NA BOLÍVIA NA VENEZUELA(INCLUSIVE EM ALTOS CARGOS) E FAZEM TREINAMENTO EM CUBA A ANOS.EM 2006 OCORREU UMA GRANDE REUNIÃO NO LIBANO ONDE TODOS SE REUNIRAM GRUPOS TERRORISTAS E A ESQUERDA MUNDIAL.NO ÚLTIMO FORO COMUNISTAS DO MUNDO TODO COMPARECERAM REPRESENTANTES ISLÂMICOS E O PRÓPRIO PRESIDENTE DO IRÃ DEU UMA PASSADA NA VENEZUELA E DOU 2 BILH~ES DE DÓLARES.PT ASSINA CONVÊNICO COM O PARTIDO BATH DA SÍRIAE PRA FINALIZAR DURANTE A CRISE ENTRE EQUADOR E COLÔMBIA NOSSO PRESIDENTE DISSE O SEGUINTE.A AMÉRICA LATINA AINDA NÃO ESTA PREPARADA PARA UMA GUERRA..ENTENDERAM????,http://orkut.google.com/c69619.html,Teoria da Conspiração,6 de maio de 2008,http://orkut.google.com/c69619-t56a38deb4f82a0e2.html,MARCELO mendes - ,Venezuela na mira dos EUA ?,4
"Para a campanha do líder nas pesquisas, o ex-bispo católico Fernando Lugo, aquela será uma data imperdível para os paraguaios escolherem entre candidatos que, como diz a propaganda, vão deixar ""ITAIPU TODO PARA O BRASIL"" ou candidatos que vão reclamar ""ITAIPU, O JUSTO PARA O PARAGUAI"". Nos cartazes, a foto de Lugo ( http://www.defesanet.com.br/yy/paraguay/lugo.jpg0 ) aparece na segunda opção. As de seus rivais, na primeira.Avaliações ouvidas pelo Valor em Assunção dão conta que há uma expectativa de que, uma vez eleito, o ex-bispo católico ligado à Teologia da Libertação (E APOIADO POR MOVIMENTOS POPULARES DE CAMPONESES, INDÍGENAS, SINDICATOS E PARTIDOS DE ESQUERDA), deverá adotar uma retórica de confronto, encorajar manifestações de rua e recorrer a outros meios para por o Brasil ""contra a parede"", ainda que para fazer jus à ansiedade do público interno.O próprio Lugo disse que considera a possibilidade de levar a uma instância internacional seu pleito contra o Brasil por preços mais elevados e ""justos"" (termo usado na Ata Final que antecedeu o Tratado de Itaipu de 1973), caso as tentativas diplomáticas não prosperem. Lugo costuma lembrar o caso da Bolívia quando usa a expressão ""soberania energética"". E recorda que, nos dois casos (Paraguai e Bolívia), a disputa foi e é com o Brasil.""Acordo sem a vontade popular [como o de Itaipu, assinado por governos militares] carece de sentido para nós"", disse ele na abertura do evento, ao lado, significativamente, de dois brasileiros: O SECRETÁRIO DE RELAÇÕES INTERNACIONAIS DO PT, WALTER POMAR, à sua direita, e o secretário-executivo do Conselho Latino-americano de Ciências Sociais (Clascso), EMIR SADER, à sua esquerda. ""Hoje se fala em recuperação da soberania energética. Não vamos descansar enquanto essa grande dívida com o povo paraguaio não se realize.""VIVA AOS CÍRCULOS BOLIVARIANOS -BRPP (BLOCO REGIONAL DO PODER POPULAR!!A URSAL AVANÇA.............http://www.defesanet.com.br/energia1/py_itaipu_1.htm",http://orkut.google.com/c69619.html,Teoria da Conspiração,19 de março de 2008,http://orkut.google.com/c69619-t5e5bb62a23dd0c21.html,MARCELO mendes - ,O CAVALO PARAGUAIO,1
http://ursal.blogspot.com/2007/11/conexo-oriente-mdio.html,http://orkut.google.com/c69619.html,Teoria da Conspiração,17 de abril de 2008,http://orkut.google.com/c69619-tbefffa469dea4b65.html,MARCELO mendes - ,Presidente do Irã diz que 11/09 é uma farsa,7
"""A CHINA ATUALMENTE POSSUI $400 BILHÕES DE INVESTIMENTOS EM TÍTULOSAMERICANOS E $1 TRILHÃO DE RESERVA CAMBIAL"".""QUAL SERIA O IMPACTO ECONÔMICO MUNDIAL SE A CHINA TRANSFORMASSE ESTA RESERVA EM EUROS????""Aqui se encontra o X da questão.O mundo praticamente bipolarizado, novamente.Porém, os EUA (dólar) são muito dependentes da China pelo motivo falado acima (investimentos e reservas pesadas em US$).Imaginem se a China convertesse em Euros e se a OPEP cotar e vender o petróleo em Euros também (o presidente do Irã fez isso isoladamente e só isso já causou um certo impacto).A questão é qual o custo benefício da Rússia ser aliada (aliada mesmo p/ guerra) com o Irã... Não acho que compense.O negócio é que Rússia está lucrando com essas zonas de conflito e toda essa tensão, pois os países de certa forma estão fazendo uma ""corrida armamentista"" e até tecnológica (fogutes p/ lançamentos de satélite) e Rússia tem armas e essa tecnologia de sobra p/ vender.Fica os EUA de cá vendendo armas p/ Israel, tiçando ainda mais Israel contra os vizinhos...E a Rússia de lá vendendo armas p/ ""vizinhos"" e aproveitando ainda de outros países com a Coréia do Norte, China e outros. Agora ainda tem o mais novo mercado a Venezuela Neo Socialista (vide Ursal rs...)Mercado de armas.... EUA X RússiaCom o cenário atual, acho que a Rússia está ganhando...É... o mercado tá mais p/ Rússia... dá p/ ela tirar uns ""trocadinhos"" a mais... Vide a experiência de ""desovação"" pós-guerra Guerra Fria... E vai nessa aí... até que um dia aconteça um ataque de maiores proporções e vire GUERRA MUNDIAL... Aí meu caro...Todo mundo sai perdendo...",http://orkut.google.com/c69619.html,Teoria da Conspiração,28 de fevereiro de 2007,http://orkut.google.com/c69619-tc5dd6fda86e3a73f.html,Bruno Assis Gonçalves - ,CONSPIRAÇÃO ASSIMÉTRICA,8
"SIM, CLARO!! COMO O FORO DE SÃO PAULO NÃO EXISTIA E AGORA LULA EM SEU DISCURSO ASSUME QUE FOI ATRAVÉS DESTE FORO QUE FORAM TRAÇADAS ESTRATÉGIAS PARA QUE A ESQUERDA ASSUMISSE TODO O CONTINENTE.ESTA ACONTECENDO!!!!A URSAL COM SEU PROJETO DE BOLIVARIANISMO TAMBÉM ERAM PALAVRAS. E AGORA NASCE O BANCO DO SUL (QUE SERÁ FINANCIADO PELA CITY DE LONDRES) E UNIVERSIDADE LATINO-AMERICANA.ESTA ACONTECENDO!!!E EM BREVE O BLOCO REGIONAL DO PODER POPULAR QUE TEM COMO OBJETIVO PRICNIPAL A FORMAÇÃO DE UM EXÉRCITO SUL AMERICANO.AGORA AS NAÇÕES QUE AINDA NÃO SOFRERÃO PRESSÕES.COLÔMBIA- PERU SERÃO OS PRIMEIROS.NÃO É A TOA QUE PERU TENTA UMA COALIZÃO COM O CHILE CONTRA O BOLIVARIANISMO. INCLUSIVE O PARLAMMENTO PERUANO EXIGIU O FECHAMENTO PELO GOVERNO DOS ESCRITÓRIOS DA ALBA (CIRCÚLOS BOLIVARIANOS) EM SEU TERRITÓRIO.E NÃO É A TOA QUE ATRAVÉS DA TENTATIVA DE DIVERSAS NAÇÕES EM INTERMEDIAR AS NEGOCIAÇÕES DA FARC COM URIBE. SÓ QUE ESTES PRESIDENTES QUE QUEREM INTERMEDIAR AS NEGOCIAÇÕES ""HUMANITÁRIAS COM AS FARC PARTICIPAM COM AS ÚLTIMAS DO FORO DE SÃO PAULO.DAQUI UNS DIAS O URIBE VAI SER O CULPADO PELOS REFÉNS!!!",http://orkut.google.com/c69619.html,Teoria da Conspiração,12 de dezembro de 2007,http://orkut.google.com/c69619-t26f573b87709457e.html,MARCELO mendes - ,OLHEM O MAPA DA AMÉRICA DO SUL HOJE,4
A DISCUSSÃO SOBRE ESTE ASSUNTO ERA REFERENTE A NÃO IDEOLOGIZAÇÃO NAS ESCOLAS.E TEVE GENTE QUE DEFENDEU DIZENDO QUE ERA CORRETO.ISTO É UM ABSURDO E CRIME MORAL!!!!!!!!!MAS COMO O TÓPICO ERA SOBRE OUTRO ASSUNTO RESOLVI ABRIR ESTE SOBRE AS FARCS NAS SALAS DE AULA PRA NÃO MISTURAR OS ASSUNTOS E INDIQUEI A QUEM ESTAVA DEFENDENDO A IDEOLOGIZAÇÃO NAS ESCOLAS.ESTOU ATÉ AGORA ESPERANDO RESPOSTAS. E NÃO FALA NADA SOBRE O LULA E 3º MANDATO.FALANDO EM UPAR VAMOS LÁ:JA ESTA CLARO QUE TU NÃO GOSTA DA MINHA PARTICIPAÇÃO NESTA COMUNIDADE COMO JA TE REFERISTE:QUANDO EU SAI TU DISSE QUE ERA UM SONHO REALIZADO!!VOLTEI E TU TE MANIFESTOU CONTRARIO.FOSTE NO PARLAMENTE PEDIR A MINHA PUNIÇÃO COM ARGUMENTOS SEM PÉ NEM CABEÇA TANTO É QUE FOSTE QUESTIONADO PELOS DEMAIS PARLAMENTARES SOBRE A FALTA DE EMBASAMENTO DA TUA SOLICITAÇÃO.TE ESQUECESTE QUE TU COMO PARLAMENTAR NÃO DEVES PESSOALIZAR A TUA FUNÇÃO COM O TEU GOSTO PARTICULAR REFERENTE AOS PARTICIPAMNTES DESTA COMUNIDADE.NÃO SATISFEITO VOLTOU NO PARLAMENTO ME ACUSANDO DE TER UPADO UM TÓPICO O QUE É MENTIRA.SE FOR VERDADE O TÓPICO DA URSAL É PURA UPAGEM POIS SEMPRE TENTO COLOCAR OS TEMAS REFERENTES NO MESMO TÓPICO.SEM FALAR NA FORMA PEJORATIVA QUE TE REFERES A MIM EM VÁRIOS TÓPICOS E ESTE É UM EXEMPLO.ENTÃO NÃO SEJA LEVIANO!!,http://orkut.google.com/c69619.html,Teoria da Conspiração,21 de agosto de 2007,http://orkut.google.com/c69619-t67b7423b14b9d82e.html,MARCELO mendes - ,PROPAGANDA SUBLIMINAR NO BANCO DO BRASIL,17
"você é complicado heim, primeior é URSAL, todo mundo unido em um objetivo comunista contra o bloco capitalista.Agora é uma guerra entre os paises da America Latina?Se ele tiver oportunidade de ver o LULA gripado, vai dizer que chegou por aqui a Gripe das Aves.",http://orkut.google.com/c69619.html,Teoria da Conspiração,17 de março de 2007,http://orkut.google.com/c69619-t4a971f3e1ee44ff3.html,Mike Expert - ,Os Tambores da Guerra,22
"podes ter certeza que a questão ideológica petista é diferente do que foi pregado neste país até hoje. falo por conhecimento de causapois militei por 17 anos no pt e sou empregado público.vou te dar um exemplo quando o pt assumiu o governo do estado do rs estipulou para o concurso do magistério e da faculdade estadual bibiográfia comunista  e revolucionária - trotsky,graminsk,mrax fora sitema socialista com referencia a fídel e chê.quando fui fazer um curso sobre direitos humanos pela prefeitura apareceu um comuna falando sobre as maravilhas do sistema cubano e sua democracia-haehaehahehahehwheha mesma coisa estão fazendo no itamaraty. no exercito escolheram um comandante que não é de armas se não me engano é da área de comunicação simpatizante ao pt. e no tópico da ursal já demonstrei que existe militares brasileiros participando de encontros de organizações comunistas pela américa latina(algo impensado até hoje)e pior que não acreditei na informação pesquisei o nome e realmente o militar tinha acbado de passar para a reserva.se tu leres os documentos petistas iras encontar a verdade pois nãoa necessidade de procurar em paginas de ideologias contrarias lá mesmo esta a verdade.",http://orkut.google.com/c69619.html,Teoria da Conspiração,5 de março de 2007,http://orkut.google.com/c69619-t8d5264cf29961d14.html,MARCELO mendes - ,GOLPE TOTALITÁRIO NO BRASIL,8
"Bem vindo a URSAL Em breve, toda América Latina se unificara em uma pseudo pátria socialista, ao estilo das ditaduras da URSS.Temos que impedir que nosso país cai nessa desgraça. Pois se esta ruim agora, ficara pior.  Vejam, Hugo Chaves pretende criar uma policia nacional especial.Nosso Lula já criou... Temas palavras como revolução cultural.Temas presidentes que são praticamente cultuados como deuses pelo povo. Olhem o quatro que irei pitar para vocês:O crime organizado  (com conexões no governo)se descontrola no Rio e em São Paulo.O governo coloca sua guarda nacional para proteger o povo.Se o Lula fechar o congresso, roubar o dinheiro do fundo de garantia, e implantar uma ditadura. A sua guarda especial estará a posto nas principais cidades para reprimir qualquer protesto.Em seguida eu e outros dessa comunidade e de outras sumiremos ou seremos presos e mortos.",http://orkut.google.com/c69619.html,Teoria da Conspiração,23 de janeiro de 2007,http://orkut.google.com/c69619-tc1e70be3956af01e.html,Fred Alvarenga - ,Bem vindo a URSAL,1
"Delenda Carthago (Cartago deve ser destruída). Catão dizia sempre isso, no  fim de todos os seus discursos.Depois da queda do Muro de Berlim em 1989, Fidel Castro convocou em 1990,  junto com Luis Inácio “Lula” da Silva e o PT, partidos estrangeiros, grupos  guerrilheiros, organizações criminosas, ... da América Latina, a uma  reunião na cidade de São Paulo onde se associaram numa organização  denominada Foro de São Paulo.O objetivo do Foro de São Paulo é o de apoiar política e financeiramente a  implantação do comunismo na América Latina. Atualmente, é implantado por  diversos modos, através de meios gramscistas, via partidos de esquerda,  “Círculos Bolivarianos”, para a concretização da URSAL (União das  Repúblicas Socialistas da América Latina).Este espaço é para a formulação de idéias que levem à neutralização do  totalitário FORO DE SÃO PAULO!Delenda Chaves, Fidel, Evo, Lula, FARC, MST, Comunistas, Esquerdopatas,...Delenda URSAL (atualmente batizada de UNASUL)!Convido p/ a Comu DELENDA FORO DE SÃO PAULO:http://www.orkut.com.br/Main#Community.aspx?cmm=42203706Esta Comu combate o comunismo bolivariano e os entreguistas brasileiros que  querem destruir as nossas FFAA, a começar pelo apedeuta-mor.Junte-se a nós.",http://orkut.google.com/c1045141.html,TERNUMA,30 de novembro de 2008,http://orkut.google.com/c1045141-t3bff8a36ed0141ee.html,Adonai Camargo - ,DELENDA FORO DE SÃO PAULO,1
"Ingênua é você, ou se faz, pouco importa....Os militares estão é sucateados, e isso começou no governo FHC...e não coloque todos eles na mesma panela...Quem não sabe é você a história...serei eternamente grata aos militares por isso aqui não ser Cuba...e oxalá não vire uma Venezuela!!!!!!!Prefiro a força popular, a democracia, mas entre uma ditadura militar e uma comunista, se eu tiver que escolher, fico com a militar sem sombra de dúvida...Já ouviu falar da URSAL???? foro de SP??? se não, devia se informar...Vou nessaCarla",http://orkut.google.com/c73071.html,FORA LULA,17 de agosto de 2007,http://orkut.google.com/c73071-t15bc517fa4615bed.html,Carla Pola - ,RESPOSTA A MINHA DECISÃO !!! LEIAM POR FAVOR !!!,17
"A Band deu! A Globo omitiu! É mais uma gafe horrosa.A bandeira dele é a da URSAL. Tá nem ai pra brasileira mesmo...""No México, Lula se esquece de saudar a bandeira brasileiraPresidente passa reto pela bandeira, mas volta após saudação feita pelo presidente mexicano CIDADE DO MÉXICO - O presidente Luiz Inácio Lula da Silva cometeu um pequeno? deslize ao chegar a uma solenidade em visita ao México. Ao passar pela bandeira brasileira, Lula esqueceu-se de saudá-la. Passou reto. Ao ver que o mexicano Felipe Calderón estava saudando a bandeira, o presidente voltou correndo para corrigir o erro.As fotos estão no meu álbum",http://orkut.google.com/c73071.html,FORA LULA,7 de agosto de 2007,http://orkut.google.com/c73071-tc91923e5c6de3a3c.html,Lucy Felix - ,ESTE VÍDEO PRECISA SER DIVULGADO!,4
"A Band deu! A Globo omitiu! É mais uma gafe horrosa.A bandeira dele é a da URSAL. Tá nem ai pra brasileira mesmo...""No México, Lula se esquece de saudar a bandeira brasileiraPresidente passa reto pela bandeira, mas volta após saudação feita pelo presidente mexicano CIDADE DO MÉXICO - O presidente Luiz Inácio Lula da Silva cometeu um pequeno? deslize ao chegar a uma solenidade em visita ao México. Ao passar pela bandeira brasileira, Lula esqueceu-se de saudá-la. Passou reto. Ao ver que o mexicano Felipe Calderón estava saudando a bandeira, o presidente voltou correndo para corrigir o erro.As fotos estão no meu álbum",http://orkut.google.com/c73071.html,FORA LULA,7 de agosto de 2007,http://orkut.google.com/c73071-tc91923e5c6de3a3c.html,Lucy Felix - ,ESTE VÍDEO PRECISA SER DIVULGADO!,4
"...Onde estamos? Na fronteira do fim, pois, a do caos, já ultrapassamos: Cut, PT, MST e outras variantes do terrorismo tupiniquim estão em franca ascensão, ora fechando universidades(Em São Paulo por covardia do Serra e falta de força da Justiça que não consegue MANDAR cumprir sua ordem judicial), ora invadindo hidroelétricas com as “campesinas”, enfim, tudo tem uma origem: O petismo. Não precisa dizer que este partido é uma aberração, como disse o procurador, uma quadrilha organizada para roubar o patrimônio público Brasileiro, ou como já disse o senador Mão Santa: O PT só perde para a AIDS em destruição. E agora, quem poderá nos defender? Se fosse no seriado do SBT...Eu! Gritaria o Chapolim... Mas, não temos Chapolim, vivemos com a sombra do “Chavez”, arremedo de Hitler, populista como seu amigo brasileiro... arquitetos do fórum de São Paulo. Um movimento de unificação socialista da América Latina, com sigla de URSAL.",http://orkut.google.com/c73071.html,FORA LULA,7 de junho de 2007,http://orkut.google.com/c73071-t7964df0723866263.html,MARCOS MATIAS #FILHODEDEUS - ,Até onde a paciência admite o vilipêndio e a provo,5
"LULA AMEAÇA EMBARCAR EM AVENTURA DE BANCO BOLIVARIANO 17.04, 17h50 por Aluízio AmorimLula e seus sequazes já estão prontos para embarcar na mais nova aventura “bolivariana”. Segundo anunciou o ministro da Fazenda, Guido Mantega, Lula deverá assinar documento concordando com a participação do Brasil num tal Banco do Sul, idéia dos cucarachas Hugo Chávez, da Venezuela e Nestor Kirschner, da Argentina. Alegam que o objetivo é criar uma alternativa ao FMI e aos demais organismos de crédito internacionais. O documento de adesão pode ser assinado nesta terça-feira, em Isla Margarita, na Venezuela, onde Lula já se encontra para uma reunião com chefes de estado latino-americanos.E sabem onde ficará a sede do Banco? Ora, em Caracas, a capital venezuelana. E a sub-sede? Em Buenos Aires, nas mãos de Kirshner. E o Brasil? Receberá bananas. E já insinuam que será o futuro banco central quando o continente latino-americano tiver uma mesma moeda dentro da planejada criação da URSAL – União das Repúblicas Socialistas da América Latina. Cáspite! Aí voltaremos sem dúvida diretamente para o tempo das cavernas. Já imaginaram o “Banco do Sul” financiando a guerrilha urbana e as invasões à propriedade privada?",http://orkut.google.com/c73071.html,FORA LULA,17 de abril de 2007,http://orkut.google.com/c73071-ta08a98111cdba107.html,Evan - USA - ,"LULA E O BANCO BOLIVARIANO, AI MAMA SOCORRO",1
URSAL... que farsa...,http://orkut.google.com/c73071.html,FORA LULA,19 de março de 2007,http://orkut.google.com/c73071-t783d50db46a9197c.html,Fabiano Jovinski - ,Querem comunismo no Brasil? enqto a China sai dele,2
"Bem vindo a URSAL Em breve, toda América Latina se unificara em uma pseudo pátria socialista, ao estilo das ditaduras da URSS.Temos que impedir que nosso país cai nessa desgraça. Pois se esta ruim agora, ficara pior.  Vejam, Hugo Chaves pretende criar uma policia nacional especial.Nosso Lula já criou... Temas palavras como revolução cultural.Temas presidentes que são praticamente cultuados como deuses pelo povo. Olhem o quatro que irei pitar para vocês:O crime organizado  (com conexões no governo)se descontrola no Rio e em São Paulo.O governo coloca sua guarda nacional para proteger o povo.Se o Lula fechar o congresso, roubar o dinheiro do fundo de garantia, e implantar uma ditadura. A sua guarda especial estará a posto nas principais cidades para reprimir qualquer protesto.Em seguida eu e outros dessa comunidade e de outras sumiremos ou seremos presos e mortos.",http://orkut.google.com/c73071.html,FORA LULA,23 de janeiro de 2007,http://orkut.google.com/c73071-t101d77ca4846a8c3.html,Espectro Das trevas - ,Bem vindo a URSAL,1
Chavez é fã de Fidel...como ele quer se perpetuar no poder...obviamente que usa a máscara do populismo para isso...Não tenho dúvida que o PT está fazendo o mesmo por aqui...estáconstruindo o terreno para ficar indefinidamente...Meu medo da URSAL é assustador....Carla,http://orkut.google.com/c73071.html,FORA LULA,1 de dezembro de 2006,http://orkut.google.com/c73071-t9e51575976c6fbb0.html,Carla Pola - ,--- CHÁVEZ QUER SE PERPETUAR ---,3
